{
  "version": "0.9.0",
  "timestamp": "2000-01-01T00:00:00.123456Z",
  "type": "telemetry",
  "client": "app_intelligence_java==1.2.3",
  "metadata": {
    "path": "/foo/bar",
    "host": "wk-dev",
    "service": "bigdata_fe",
    "correlationId": "1234",
    "accountId": "1234",
    "documentId": "1234",
    "userId": "1234",
    "anything_else": "you_want_to_create_a_dimension_for"
  },
  "time_series": {
    "rpc_total_count": {
      "values": [
        {
          "timestamp": "2000-01-01T00:00:00Z",
          "value": 212
        },
        {
          "timestamp": "2000-01-01T00:00:01Z",
          "value": 121
        }
      ],
      "metadata": {
        "rpc": "1"
      },
      "sample_rate": 0.5
    },
    "exec_time": {
      "units": "ms",
      "values": [
        {
          "timestamp": "2000-01-01T00:00:00Z",
          "value": 21
        },
        {
          "timestamp": "2000-01-01T00:00:01Z",
          "value": 12
        }
      ]
    }
  },
  "counters": {
    "status_code.200": {
      "values": [
        {
          "timestamp": "2000-01-01T00:00:00Z",
          "value": 1
        }
      ],
      "metadata": {
        "http": "1"
      }
    },
    "read.ops": {
      "values": [
        {
          "timestamp": "2000-01-01T00:00:00Z",
          "value": 1234
        }
      ]
    }
  },
  "gauges": {
    "read.iops": {
      "values": [
        {
          "timestamp": "2000-01-01T00:00:00Z",
          "value": 4321
        }
      ]
    }
  }
}
